{
  "schema_version": 1,
  "artifact_role": "BASE_V9_4_3_COMPATIBILITY_RELEASE_LOCK",
  "release_line": "v9.4.3",
  "release_state": "TRUSTED_EVIDENCE_PENDING",
  "repository": "alsdmlals4-eng/Base",
  "release_issue": 148,
  "source_pr": 143,
  "predecessor": {
    "path": "base-v9.4.2.lock.json",
    "release_line": "v9.4.2",
    "release_commit": "dd705d7f48a7919187bc0507610ba5fc5b43a658",
    "release_evidence_commit": "0c6cdd128bf1f5782e96b3a6240c9585f8d1ef6d"
  },
  "candidate_release_commit": "7dd1a4f80388bc5faca767ff74a3eb32dc9d0ac8",
  "candidate_release_evidence_commit": null,
  "candidate_registry": {
    "path": "skills/SKILL_REGISTRY.json",
    "sha256": "693a0dff3f054ecdd653079909e044211473838e73dd9aff07734d1ce5694c59",
    "hash_definition": "RAW_FILE_BYTES_SHA256"
  },
  "released_validator_paths": [
    "tests/test_first_prompt_intake_contract.py",
    "tests/test_base_v9_4_ai_operations_contract.py",
    "tests/test_consolidated_skill_references.py",
    "skills/managing-project-intake-and-work-contract/references/first-prompt-direction-anchoring.md"
  ]
}
